<?xml version="1.0" encoding="UTF-8"?>
<Potvrda xmlns="www.ftn.uns.ac.rs/potvrda_o_vakcinaciji"
 xmlns:xsi="http://www.w3.org/2001/XMLSchema-instance"
 xsi:schemaLocation="www.ftn.uns.ac.rs/potvrda_o_vakcinaciji PotvrdaOVakcinaciji.xsd">
    <Sifra_potvrde>23532</Sifra_potvrde>
    <pacijent>
        <Ime_i_prezime>Petar Markovic</Ime_i_prezime>
        <Datum_rodjenja>1999-10-29</Datum_rodjenja>
        <Pol>Musko</Pol>
        <Jmbg>2910999730020</Jmbg>
    </pacijent>
    <Vakcinacija_info>
        <Prva_doza>
            <Datum_vakcine>2021-03-04</Datum_vakcine>
            <Serija_vakcine>EW2243</Serija_vakcine>
        </Prva_doza>
        <Zdravstvena_ustanova>Dom zdravlja Novo Naselje</Zdravstvena_ustanova>
        <Naziv_vakcine>Pfizer BionTech</Naziv_vakcine>
        <Datum_izdavanja>2021-05-04</Datum_izdavanja>
    </Vakcinacija_info>
    <Qr_kod>NSw2LDQsMiw0MjMsNDIzLA==</Qr_kod>
</Potvrda>
